{
  "version": "0.1",
  "brief_id": "brief-minimal-cabinet",
  "domain": "generic",
  "user_request": "Draw a European style cabinet, width 1800, height 2400, depth 600.",
  "intent": "create_parametric_object_preview",
  "source_language": "en",
  "constraints": ["preview_only", "use_CODEX_PREVIEW"],
  "assumptions": ["base point is the drawing origin until a project space is supplied"],
  "needs_confirmation": false
}
